{
    "name": "ios-salesforce",
    "platform": "ios",
    "version": "1.0.0",
    "extends": {
        "template": "ios-base",
        "version": "1.0.0",
        "patchFile": "layer.patch"
    },
    "tags": [
        "ios",
        "salesforce",
        "mobile-sdk"
    ],
    "description": "iOS template with Salesforce Mobile SDK integration"
}
