{
  "$schema": "../../schemas/template.schema.json",
  "name": "ios-mobilesdk",
  "platform": "ios",
  "version": "1.0.0",
  "description": "Functional iOS application with Salesforce Mobile SDK integration. Includes OAuth authentication",
  "tags": [
    "ios",
    "swift",
    "salesforce",
    "mobile-sdk",
    "oauth"
  ],
  "extends": {
    "template": "ios-base",
    "version": "1.0.0",
    "patchFile": "layer.patch"
  }
}